VesselID,VesselName,LOA,Breadth,Depth,Draught,Displacement,LCG,VCG,WindArea,CurrentArea,OilCapacity,Description
FPSO_P50,FPSO P-50 Class,300.0,60.0,30.0,18.0,200000.0,0.0,10.0,8000.0,6000.0,1600000.0,Standard FPSO for deepwater operations
FPSO_P70,FPSO P-70 Class,320.0,65.0,32.0,19.0,250000.0,0.0,11.0,9000.0,7000.0,2000000.0,Large FPSO for ultra-deepwater
FPSO_P30,FPSO P-30 Class,270.0,50.0,27.0,16.0,150000.0,0.0,9.0,6500.0,5000.0,1200000.0,Compact FPSO for shallow water
FPSO_SPREAD,FPSO Spread Moored,310.0,62.0,31.0,18.5,220000.0,0.0,10.5,8500.0,6500.0,1800000.0,FPSO with spread mooring system
FPSO_TURRET,FPSO Turret Moored,305.0,61.0,30.5,18.2,210000.0,0.0,10.2,8200.0,6200.0,1700000.0,FPSO with internal turret mooring
